188489,港大毕业生,哥哥我中考 求保佑,,,2020/07/18 17:50:47,7月15日 07:33,2
188489,蓝天使_,我也喜欢百合真的,0xffff,,2020/07/18 17:50:48,7月15日 00:28,0
188489,皌枍,哥哥，给予我力量吧，中考啦，借你光，我一定能考好，对吧。我可是张国荣先生的粉呀，应该争气点.,,,2020/07/18 17:50:48,7月15日 00:22,3
188489,皌枍,在哥哥声音停的那一瞬，歌迷大声呼喊的那一瞬，真的好感动好感动,,,2020/07/18 17:50:48,7月14日 23:49,0
188489,皌枍,真实了！我同桌天天说什么男星我看了真的和哥哥比不了，不是我偏心，是真的，各方面，没有他的颜值和气质，更没有他的才艺和迷人。哥哥是心头朱砂，但他在我诞生的前一年，和我别过了。风继续吹，尽管如此，也不忘哥哥，忘不了。,漂亮哥哥呢,为什么我活在左手右手一个慢动作都能火的年代,2020/07/18 17:50:48,7月14日 23:47,1
188489,鱼汤er,"中考前夜来听哥哥的歌，在这儿做个记录~
中考顺利，中考加油！",,,2020/07/18 17:50:48,7月14日 23:40,1
188489,许嵩什么时候来娶我,不是吧不是吧，现在还有人没有了解过别人就开始在公众平台上发言了？,NepartakMiagaloo,一个同性恋，仅此而已,2020/07/18 17:50:48,7月14日 21:48,0
188489,鲺眠,星星！！！！！！！！！,张GR先生,多希望我生在张国荣和黄家驹的时代。遗憾的是我却生在了王俊凯。鹿晗的时代🍂,2020/07/18 17:50:48,7月14日 21:47,0
188489,笑涵1,来了,,,2020/07/18 17:50:48,7月14日 21:47,0
188489,张猴子就要爱,恭喜，爱哥哥，然后越来越优秀,VIC_________________,哥哥，我收到你母校的录取了，利兹大学。我一定要去。去看看你走过的路。,2020/07/18 17:50:49,7月14日 21:29,0
