id,nick,comment,refer_nick,refer,time,star
1410815872,Opal_00,2020.3.25.她离开我们的第2457天。姥姥是在我小升初当天去世 的，享年八十有一。那时候太小了，会常常在意我不是她最疼的小辈，她对哥哥宠爱有加，却不准我换一次电视台。去年高考结束后知道我并非亲生，才觉得一切都是理所当然。现在时常想起那个老太太，也没有那么凶嘛。感恩相遇。,,,3月25日 10:02,3
1410815872,小言在云朵上打盹,外婆您已经离开我十年多了我今年上初三了很好你没有看到小姨嫁为人妻但是你有三个外孙一个外孙女而您就是把我这个顽皮小女孩看大我们四个人的乳名很有寓意龙乐安响谐音就是荣乐安享我都快忘记你的声音了但是你永远是我最爱的人希望您可以让外公好好地我小时候答应过他长大后要带他去赶集,,,3月25日 09:53,4
1410815872,不正经的张先生,我在姥姥家一待就是七年，整整七年，那时候特不听话，老是惹他们生气，从以前的恨不得离开到后来的不愿离开。现在外公外婆老了，耳朵背了，身体也没有以前那么硬朗了，好害怕他们离开，好害怕我的妈妈没了爸爸妈妈，好害怕我没了姥姥姥爷，愿2020一切安好！请你们等我长大,,,3月25日 09:37,4
1410815872,stay_ZS,挺好听的，多希望外婆别老的那么快，我也不想长大的那么快,,,3月25日 08:45,0
1410815872,巨兔ing,离开的时候，分明见到了你眼角的那颗透明的晶体...,,,3月25日 08:40,2
1410815872,凌沉宸,听妈妈说啊，外婆年轻时候是个漂亮的女孩子呢。可我从未见过她啊，她走的很早，来不及。,,,3月25日 08:26,2
1410815872,青春音符飘,想起俄国文豪高尔基的外婆，善良淳朴，影响从小在外婆身边长大的作家的一生。,,,3月25日 08:07,1
1410815872,一心向烊-WLT,抱抱，我们换种方式去想，你外婆已不用受病魔缠身了，或许这是种比较好的结局吧，不伤心了，希望你能有更美好的生活，能够受到最温柔的对待,今天要早早早点睡觉,外婆去世的那天我在学校，准备期末考试，有一天晚上我打电话给我妈妈，却发现她语气不对劲，我问：“你没事吗？”她说没事，我又问：“外婆没事吧？”她说外婆挺好的，叫我别担心好好考试。放学那天我妈才跟我说，我打电话过去那天外婆刚好去世了。或许这是我们之间最后的感应了吧......,3月24日 22:45,0
1410815872,秋末梨花,散养溜达猴？我可不可以做越狱奇葩猪🐷,,,3月24日 22:37,1
1410815872,楠空呀,"从小都跟姥姥姥爷一起长大 他们给我的爱比爸妈都多 😌😌😌 现姥姥眼睛看不见了 姥爷有病了 我现在最担心的都是他们 每次通话 听到他们的声音我就放心了 我真的很怕很怕那天来临
等我能探亲回家一定带你们去趟北京！",,,3月24日 21:47,1
1410815872,仙女歪歪,希望她来世还能遇见我。,卑微楠一,其实你外婆在那边一定过的挺好，不然她怎么不舍得回来，加油，你外婆一定也希望你过的特别好,3月24日 20:30,1
1410815872,卑微楠一,其实你外婆在那边一定过的挺好，不然她怎么不舍得回来，加油，你外婆一定也希望你过的特别好,仙女歪歪,"外婆啊.每次想起你还是会泪目.你对我那么那么好.怎么这次就那么狠心.连离开都不和我说再见. 你过得好吗. 我高三了.身体也很好小时候真是辛苦你了.我有藏你照片的但是被妈妈拿走烧了.
对不起啊外婆我好想你我快记不得你的样子你的声音了.",3月24日 20:18,0
1410815872,寻伊一,从小在外公外婆身边长大已经十七年了啊外公外婆经营了一家饭店外公对我很好我想吃什么就给我做什么很护着我小时候淘气额头窗户边上磕了一个坑外公就把窗沿重新装了一种软的东西上小学外公骑着他的自行车接送我上下学一年级二年级…无论春夏秋冬无论什么天气外公是一个不善言辞的人有什么都不会说出来…,,,3月24日 19:52,2
1410815872,寻伊一,蜗从小就是外婆带大的外婆对我很好很好很好外婆是我最最重要的人外婆现在身体健康我希望她能一直这么健康明年我就高考了我想要快点努力挣钱带她去看看各种美丽风景带她去吃各种好吃的去体验各种各样的新鲜事物…我记得初中的时候我写了一篇作文题目是你陪我长大我陪你到老.您你一定要健健康康的.,,,3月24日 19:35,0
1410815872,桌子不齐GEM邓紫棋,趁现在还来得及，我就想多陪陪您，亲爱的 外婆,,,3月24日 09:35,1
1410815872,老涵本人0519,我们一样,Aryyer,"小时候爸妈吵架，问我要跟谁，我说我谁也不跟，我要跟着阿婆
长大后爸妈又吵架了，阿婆，我还能跟着你去天国吗",3月24日 08:30,0
1410815872,咪_呜-,外婆虽然是聋哑人，但她最偏爱我啊，小时候的温暖记忆,,,3月23日 22:58,1
1410815872,Kobebean_4life,外婆，想念您那和蔼的笑容，想念您叫我的名字，想念您每次都那吃东西给我吃，世界上最最好的外婆，下辈子还做您的外孙，爱您。,,,3月23日 20:51,0
1410815872,除你武器DA,我现在15岁，姥姥姥爷60多，我相信他们能到百，还能陪我30多年，想想就开心啊,,,3月23日 15:48,2
1410815872,老涵本人0519,加油！,橙阿淇,加油鸭！,3月22日 22:25,0
1410815872,橙阿淇,加油鸭！,老涵本人0519,今年是外婆离我而去的10个年头 今年我也要高考了 我一定我可以考上郑大医学院！,3月22日 03:33,1
1410815872,元気小瑶,每次听这首歌 都会哭 太想外婆外公了 算一算 大概快三年没见他们了 暑假我一定会去看你们!!,,,3月22日 02:03,1
1410815872,能吃蛋糕吗,她真的全世界最喜欢我 我都十九了 她还在叫我宝贝 第一部智能手机屏保就是我 手机快捷键的号码也要求设置成我的～我真的特别特别喜欢她～,A青扶,是的 感觉只有外婆把我当成唯一了 不是独生子女，多少会感觉父母的爱不唯一,3月22日 01:46,0
1410815872,A青扶,是的 感觉只有外婆把我当成唯一了 不是独生子女，多少会感觉父母的爱不唯一,能吃蛋糕吗,你们都跟我一样是跟外婆长大的孩子吗,3月22日 01:26,2
1410815872,能吃蛋糕吗,你们都跟我一样是跟外婆长大的孩子吗,,,3月22日 00:02,2
1410815872,只要完全和你合眼缘,什么东西都藏着偷偷给我的小老太太 春天要到了 天堂的花不知道开的是不是和人间一样灿烂？,,,3月21日 22:46,2
1410815872,Ariel的海底世界,到现在为止 一想到外婆 还是好想哭哦,,,3月21日 17:05,2
1410815872,Aryyer,"小时候爸妈吵架，问我要跟谁，我说我谁也不跟，我要跟着阿婆
长大后爸妈又吵架了，阿婆，我还能跟着你去天国吗",,,3月21日 15:51,2
1410815872,Zen_2020,Hug hug!,奈斯文慧,昨天她离开了我们,3月21日 14:25,0
1410815872,AD缺钙i,外婆她六十一岁了，她比任何人都在意细节。我说不吃香菜，她就没有在菜里加香菜，我说黄豆浆比较好喝，她就没有煮过黑豆浆了，我说我又找不到衣服穿了，她把她的睡衣给我还每次帮我把衣服收拾好…我想 应该换我来照顾她了。,,,3月21日 10:19,1
1410815872,是怦然呐,希望我的姥姥健健康康快快乐乐 不用太累,,,3月20日 22:37,2
1410815872,老涵本人0519,加油姐妹！,是只肥鹤吖,一定可以！一起加油！,3月20日 10:13,1
1410815872,是只肥鹤吖,一定可以！一起加油！,老涵本人0519,今年是外婆离我而去的10个年头 今年我也要高考了 我一定我可以考上郑大医学院！,3月20日 08:28,2
1410815872,是只肥鹤吖,等我上大学！外婆外公，我答应过您们的，带你们去旅游！外公喜欢摄影旅游，我要给他买单反，要带你们一起去更美的地方！你们一定要好好的！外孙女在努力，你们这盏灯这束光，一定要继续照着我！,,,3月20日 08:27,1
1410815872,老涵本人0519,外婆是我最重要的人,,,3月19日 17:07,9
1410815872,老涵本人0519,今年是外婆离我而去的10个年头 今年我也要高考了 我一定我可以考上郑大医学院！,,,3月19日 17:06,17
